1;
Проведены прецизионные измерения электросопротивления, термоэдс и объема TmS, TmSe и TmTe при гидростатическом давлении до 8 ГПа.;42 Results-Reference
Сравнение поведения транспортных свойств и объема TmTe и SmTe в области валентного перехода демонстрирует полную аналогию, вплоть до количественного совпадения.;42 Results-Reference
Показано, что термоэдс всех халькогенидов тулия и самария и в области коллапса решетки, и при последующей перестройке электронного спектра в широком диапазоне давлений подчиняются единой универсальной зависимости, соответствующей прохождению уровня Ферми через пик плотности состояний.;42 Results-Reference
Результаты обсуждаются в рамках представлений об экситонной природе промежуточной валентности в халькогенидах редкоземельных металлов.;51 Conclusions-Explanation
23;
Приведен вывод интеграла столкновений в кинетическом уравнении для разреженного спин-поляризованного газа фермионов (электронов).;42 Results-Reference
Учитываются столкновения между этими фермионами и столкновения с гораздо более тяжелыми частицами (ионами), образующими случайно расположенный неподвижный фон (газ).;42 Results-Reference
Важным новым обстоятельством является то, что амплитуда рассеяния частиц друг на друге не предполагается малой, которую можно было бы получить, например, в первом борновском приближении.;53 Conclusions-Reference
Полученный нами интеграл столкновений можно использовать в кинетическом уравнении, в том числе и для относительно холодной разреженной спин-поляризованной плазмы с характерной энергией электронов, меньшей α2 me c2, где α - постоянная тонкой структуры.;52 Conclusions-Specific
24;
Развита динамическая теория когерентного рентгеновского излучения, генерируемого в монокристаллической пластине расходящимся пучком релятивистских электронов.;42 Results-Reference
Исследована зависимость спектрально-угловой плотности когерентного рентгеновского излучения от угла расходимости электронного пучка для случая, когда угловой разброс описывается двумерным распределением Гаусса.;42 Results-Reference
Построенная теория позволяет проводить расчеты когерентного излучения и для произвольного углового распределения электронов в пучке.;51 Conclusions-Explanation
25;
Рассмотрены характерные и отличительные особенности амплитуды функции видности интерферометрических наблюдений у компактных объектов типа звезд в ближайшей окрестности центральной черной дыры в нашей галактике.;42 Results-Reference
Эти особенности связаны со спецификой сильного гравитационного рассеяния точечных источников черными дырами, кротовыми норами или черно-белыми дырами.;51 Conclusions-Explanation
Найденные особенности помогут определить важнейшие топологические характеристики центрального объекта в нашей галактике: обладает ли этот объект свойствами только черной дыры или также имеет характеристики, присущие только кротовым норам или черно-белым дырам.;52 Conclusions-Specific
Данные исследования могут быть использованы для интерпретации результатов интерферометрических наблюдений в оптическом, инфракрасном и радио диапазонах.;52 Conclusions-Specific
26;
При помощи сканирующей туннельной микроскопии проведены исследования динамики вращения молекул C60 в монослойных пленках фуллерена выращенных на поверхности WO2/ W(110).;31 Method-Specific, 32 Method-Procedure, 42 Results-Reference
Вблизи температуры вращательного фазового перехода обнаружено образование кластеров молекул, обладающих большой амплитудой либронных колебаний.;42 Results-Reference
Определены энергетические параметры, определяющие изменение ориентации молекулы: разность энергий между ближайшими минимумами энергии молекул C60 в зависимости от ее ориентации (30 мВ) и высота потенциального барьера между ними (610 мВ).;41 Results-Specific
Результаты обсуждаются в рамках приближения теории среднего поля.;53 Conclusions-Reference
27;
Предлагается модель дисперсионного переноса в неупорядоченных наноструктурированных полупроводниках, учитывающая перколяционную структуру образца и параллельное действие нескольких механизмов.;2 Problem
Совместный учет топологического и энергетического беспорядков проведен на основе модели многократного захвата на гребешковой структуре, моделирующей перколяционный характер траекторий.;42 Results-Reference
Действие параллельных механизмов описано в рамках случайных блужданий со смесью распределений времен ожидания.;42 Results-Reference
Получены интегральные уравнения переноса с производными дробного порядка для произвольной плотности локализованных состояний.;42 Results-Reference
В рамках новой модели рассчитывается кинетика переходного тока с целью анализа время-пролетных экспериментов для наноструктурированных полупроводников.;42 Results-Reference
28;
Для нематических жидких кристаллов (НЖК)  с примесью конформационно активных соединений, находящихся под воздействием светового, низкочастотного электрического и магнитного полей, предложена теория ориентационных переходов, использующая разложение вращающих моментов, действующих на директор НЖК, по углу поворота директора.;42 Results-Reference
Построены фазовые диаграммы состояния НЖК в зависимости от интенсивности и поляризации светового поля, напряженности низкочастотного электрического поля и параметра, характеризующего обратную связь между поворотом директора НЖК и оптическим вращающим моментом.;42 Results-Reference
Определены условия возникновения переходов второго и первого рода.;42 Results-Reference
Предложенная теория согласуется с экспериментом.;52 Conclusions-Specific
29;
Рассмотрена кинетика атомов в трехмерной магнитооптической ловушке (МОЛ).;2 Problem
Для атома с оптическим переходом Jg=0 → Je=1 (Jg,e - полные угловые моменты в основном и возбужденном состояниях) в квазиклассическом приближении построена трехмерная модель МОЛ с учетом влияния относительных фаз световых полей на кинетику атомов.;42 Results-Reference
Показано, что влиянием относительных фаз можно пренебречь только в пределе малых интенсивностей световых полей.;42 Results-Reference
В общем случае выбор относительных фаз может оказывать сильное влияние на кинетику атомов в МОЛ.;53 Conclusions-Reference
30;
Проверяется тождество, которое связывает двухточечные функции Грина \cN=1 СКЭД с Nf ароматами, регуляризованной высшими производными, с помощью явных вычислений в трехпетлевом приближении.;2 Problem
Это тождество объясняет, почему в пределе нулевого внешнего импульса двухточечная функция Грина калибровочного суперполя задается интегралами от двойных полных производных в импульсном пространстве.;51 Conclusions-Explanation
Также оно позволяет вывести β-функцию NSVZ точно во всех петлях, если ренормгрупповые функции определяются в терминах голой константы связи.;51 Conclusions-Explanation
Для проверки рассматриваемого тождества оно используется для построения интегралов, определяющих трехпетлевую β-функцию, на основе двухточечных функций Грина для суперполей материи в двухпетлевом приближении.;2 Problem
Показано, что результаты для этих интегралов совпадают с суммами соответствующих трехпетлевых суперграфов.;42 Results-Reference
31;
Проведена экспериментальная проверка теоретического утверждения, что параметр асимметрии Фано и асимптотическая начальная фаза гармонического осциллятора, взаимодействующего с континуумом, взаимосвязаны.;42 Results-Reference
На примере когерентных полносимметричных A1g-фононов висмута, возбуждаемых сверхкороткими лазерными импульсами при гелиевой температуре, показано, что для отрицательных значений параметра асимметрии с уменьшением модуля параметра асимптотическая фаза возрастает.;32 Method-Procedure, 42 Results-Reference
32;
Представлены результаты экспериментального исследования свойств обладающих магнитоэлектрическим эффектом эпитаксиальных пленок ферритов-гранатов состава ( LuBi)3( FeGa)5 O12, выращенных на подложках с (210)-ориентацией.;32 Method-Procedure, 42 Results-Reference
Получены данные об особенностях наведенной анизотропии и поведении доменной структуры пленок в однородных и неоднородных внешних полях.;42 Results-Reference
Выполнен критический анализ существующих гипотез о природе магнитоэлектрической связи в изучаемых объектах.;42 Results-Reference
33;
Рассмотрено влияние конечной ширины спектральной линии лазерного излучения и спонтанной релаксации уровней на эффективность подавления полевого сдвига центрального резонанса для обобщенной схемы Рамси с импульсами разной длительности и скачком фазы во втором импульсе.;42 Results-Reference
Определены оптимальные условия схемы, соответствующие минимальному сдвигу частоты и максимальной амплитуде резонанса.;42 Results-Reference
34;
Проведено теоретическое исследование зависимости времени спин-пайерлсовского фазового перехода τ от длительности τp возбуждающего светового импульса и среднего числа x0 поглощенных фотонов на магнитный ион после прохождения импульса.;42 Results-Reference
Показано, что фазовый переход происходит при x0c.;41 Results-Specific
Найдена зависимость критического значения xc от длительности τp светового импульса.;42 Results-Reference
Вычислено фотоиндуцированное изменение коэффициента оптического отражения R в зависимости от времени t.;42 Results-Reference
Проведено сравнение с экспериментом  по сверхбыстрому фотоиндуцированному плавлению низкотемпературной спин-пайерлсовской фазы в калий -тетрацианхинодиметан (K-TCNQ).;42 Results-Reference
35;
Развит формализм обменной теории возмущений для случая взаимодействий, явно зависящих от времени.;42 Results-Reference
Поправки к волновой функции, полученные во всех порядках теории возмущений и представленные в инвариантной форме, включают в себя обменные вклады, обусловленные межцентровыми перестановками электронов в сложных многоцентровых системах.;42 Results-Reference, 51 Conclusions-Explanation
Для столкновений атомных систем с произвольным типом взаимодействия получены общие выражения для S- и T-матриц переходов и матрицы рассеяния, в которых последовательно учитываются межцентровые перестановки электронов между перекрывающимися неортогональными состояниями, принадлежащими разным центрам (атомам).;42 Results-Reference
Рассмотрена задача столкновения альфа-частицы с атомом лития с перераспределением электронов между центрами.;42 Results-Reference
Вычислено дифференциальное и полное сечения перезарядки лития.;42 Results-Reference
36;
Изучается взаимодействие поверхностной упругой волны Рэлея с электрон-дырочной плазмой двумерного полуметалла, обусловленное двумя механизмами взаимодействия - деформационного потенциала и пьезоэффекта.;2 Problem
Получены дисперсионные уравнения, описывающие связанные плазмон-акустические моды для обоих типов взаимодействия.;42 Results-Reference
Вычислено затухание рэлеевской волны.;42 Results-Reference
Рассчитано затухание акустической и оптической плазменных мод, обусловленное излучением звука плазменными колебаниями в объем подложки.;42 Results-Reference
Показано, что излучение звука в основном обусловлено акустической плазменной модой в случае деформационного механизма, и оптической - в случае пьезомеханизма.;42 Results-Reference
37;
Представлены результаты экспериментального наблюдения плавления плазменно-пылевого монослоя (двумерный фазовый переход) в газовом разряде низкого давления.;42 Results-Reference
Проведены измерения и выполнен анализ парных и ориентационных корреляционных функций, а также числа топологических дефектов в монослое.;42 Results-Reference
Характер изменения ориентационных корреляционных функций подтверждает существование фазового перехода твердое тело - гексатическая фаза - жидкость, что полностью согласуется с теорией Березинского - Костерлица - Таулесса.;51 Conclusions-Explanation
38;
Вычислен лэмбовский сдвиг (2P1/2-2S1/2) в ионах мюонного гелия (\mu ^3_2{\rm He})^+, (\mu ^4_2{\rm He})^+ с учетом вкладов порядка α3, α4, α5 и α6.;41 Results-Specific
Особое внимание уделено поправкам на поляризацию вакуума, структуру и отдачу ядра.;42 Results-Reference
Полученные численные значения сдвига 1259.8583 мэВ ((\mu ^3_2{\rm He})^+) и 1379.1107 мэВ ((\mu ^4_2{\rm He})^+) могут рассматриваться как надежная оценка при сравнении с экспериментальными данными коллаборации CREMA.;41 Results-Specific
39;
Проведен симметрийный анализ моноклинной, орторомбических и тригональной сверхструктур типа M3 X2, которые могут образовываться в сильно нестехиометрических соединениях MXy со структурой B1.;42 Results-Reference
Определены каналы переходов беспорядок-порядок MXy \rightarrow M3X2.;42 Results-Reference
Показано, что при понижении температуры в нестехиометрических соединениях MXy переходных металлов IV группы возможны две физически допустимые последовательности превращений, связанных с образованием сверхструктур M3 X2.;42 Results-Reference
На примере карбида ванадия VCy показана возможность образования орторомбической или моноклинной сверхструктуры V3 C2 с формированием наноструктуры.;42 Results-Reference
40;
Для моттовских диэлектриков с тетраэдрическим окружением получена зависимость эффективного параметра Хаббарда Ueff от давления.;42 Results-Reference
Эта зависимость не универсальна.;42 Results-Reference
Для кристаллов с d5-конфигурацией спиновый кроссовер подавляет электронные корреляции,  для d4-конфигураций параметр Ueff увеличивается после спинового кроссовера.;52 Conclusions-Specific
Для d2- и d7-конфигураций Ueff растет с повышением давления в высокоспиновом состоянии и насыщается после спинового кроссовера.;52 Conclusions-Specific
Рассмотрены особенности перехода диэлектрик-металл с ростом давления, показана возможность каскадов из нескольких переходов для разных конфигураций.;41 Results-Specific
41;
Анализируется параметрическая распадная неустойчивость электронной циклотронной волны необыкновенной поляризации, в результате развития которой возбуждаются два верхнегибридных плазмона на частотах, близких к половине частоты волны накачки.;2 Problem
Показано, что порог возбуждения неустойчивости двухплазмонного распада может существенно снижаться в условия экспериментов по электронному циклотронному нагреву в тороидальных магнитных ловушках, где профиль плотности плазмы зачастую оказывается немонотонным, что приводит к локализации верхнегибридных волн.;42 Results-Reference
42;
Проведено исследование устойчивости равновесия и нелинейных режимов неоднородно нагретой слабопроводящей жидкости в горизонтальном конденсаторе в поле тяжести и постоянном электрическом поле при униполярной инжекции заряда.;42 Results-Reference
Рассмотрена модель, в которой плотность инжектируемых с катода зарядов пропорциональна напряженности электрического поля в конденсаторе.;42 Results-Reference
Найдены зависимости критических параметров от степени нагрева и инжекции заряда.;42 Results-Reference
Изучено влияние числа Прандтля на границы неустойчивости равновесия и на частоту нейтральных колебаний.;42 Results-Reference
Нелинейные режимы электроконвекции исследованы при нагреве снизу.;42 Results-Reference
43;
