1;
Correspondingly, generally speaking, the effect of anomalously strong light absorption at the defect mode frequency and the decrease in the lasing threshold are not so pronounced as in the case of the DMS with an isotropic defect layer without dielectric jumps at the interfaces.;42 Results-Reference
The case of a DMS with a low defect layer birefringence and sufficiently large dielectric jumps are studied in detail.;42 Results-Reference
The options of effectively influencing the DM parameters by changing the defect layer dielectric properties, and the birefringence in particular, are discussed.;53 Conclusions-Reference
24;
The dynamics of a bubble in a dielectric liquid under the influence of a uniform external electric field are considered.;42 Results-Reference
It is shown that in the situation where the boundary motion is determined only by electrostatic forces, the special regime of fluid motion can be realized for which the velocity and electric field potentials are linearly related.;42 Results-Reference
In the two-dimensional case, the corresponding equations are reduced to an equation similar in structure to the well-known Laplacian growth equation, which, in turn, can be reduced to a finite number of ordinary differential equations.;42 Results-Reference
This allows us to obtain exact solutions for asymmetric bubble deformations resulting in the formation of a finite-time singularity (cusp).;42 Results-Reference
25;
We briefly review the generalized dynamic mean-field theory DMFT+Σ applied to both repulsive and attractive disordered Hubbard models.;2 Problem
We examine the general problem of metal-insulator transition and the phase diagram in the repulsive case, as well as the BCS-BEC crossover region of the attractive model, demonstrating a certain universality of single-electron properties under disordering in both models.;2 Problem
We also discuss and compare the results for the density of states and dynamic conductivity in the repulsive and attractive cases and the generalized Anderson theorem behavior of the superconducting critical temperature in the disordered attractive case.;2 Problem
A brief discussion of the behavior of Ginzburg-Landau coefficients under disordering in the BCS-BEC crossover region is also presented.;2 Problem
26;
We theoretically study nonradiative and radiative energy transfer between two localized quantum emitters, a donor (initially excited) and an acceptor (receiving the excitation).;2 Problem
The rates of nonradiative and radiative processes are calculated depending on the spatial and spectral separation between the donor and acceptor states and for different donor and acceptor lifetimes for typical parameters of semiconductor quantum dots.;32 Method-Procedure
We find that the donor lifetime can be significantly modified only due to the nonradiative Förster energy transfer process at donor-acceptor separations of approximately 10 nm - depending on the acceptor radiative lifetime) and for the energy detuning not larger than 1-2 meV.;41 Results-Specific
The efficiency of the nonradiative Förster energy transfer process under these conditions is close to unity and decreases rapidly with an increase in the donor-acceptor distance or energy detuning.;42 Results-Reference
At large donor-acceptor separations greater than 40 nm, the radiative corrections to the donor lifetime are comparable with nonradiative ones but are relatively weak.;41 Results-Specific
27;
We study holographic thermalization of a strongly coupled theory inspired by two colliding shock waves in a vacuum confining background.;2 Problem
Holographic thermalization means a black hole formation, in fact, a trapped surface formation.;1 Background
As the vacuum confining background, we considered the well-know bottom-up AdS/QCD model that provides the Cornell potential and reproduces the QCD β-function.;32 Method-Procedure
We perturb the vacuum background by colliding domain shock waves that are assumed to be holographically dual to heavy ions collisions.;32 Method-Procedure
Our main physical assumption is that we can make a restriction on the time of trapped surface formation, which results in a natural limitation on the size of the domain where the trapped surface is produced.;32 Method-Procedure
This limits the intermediate domain where the main part of the entropy is produced.;32 Method-Procedure
In this domain, we can use an intermediate vacuum background as an approximation to the full confining background.;32 Method-Procedure
We find that the dependence of the multiplicity on energy for the intermediate background has an asymptotic expansion whose first term depends on energy as E1/3, which is very similar to the experimental dependence of particle multiplicities on the colliding ion energy obtained from the RHIC and LHC.;42 Results-Reference
However, this first term, at the energies where the approximation of the confining metric by the intermediate background works, does not saturate the exact answer, and we have to take the nonleading terms into account.;42 Results-Reference
28;
We study the creation of high-energy SM particles in the Starobinsky model of dark energy (a variant of F(R)-gravity) inside the regions contracting due to the Jeans instability.;2 Problem
In this modification of gravity, the additional degree of freedom - a scalaron - behaves as a particle with the mass depending on matter density.;1 Background
Therefore, when the mass changes, light scalarons could be created at a nonadiabatic stage.;42 Results-Reference
Later, the scalaron mass grows and can reach large values, even the value 1013 GeV, favored by early time inflation.;41 Results-Specific
Heavy scalarons decay contributing to the cosmic ray flux.;41 Results-Specific
We analytically calculate the number density of created particles for the exponential (Jeans) contraction and find it negligibly small for the phenomenologically viable and cosmologically interesting range of model parameters.;32 Method-Procedure
We expect similar results for a generic model of F(R)-gravity mimicking the cosmological constant.;52 Conclusions-Specific
29;
Hidden symmetry in dissipationless terms of arbitrary hydrodynamics equations is recognized.;42 Results-Reference
We demonstrate that all fluxes are generated by a single function and derive conventional Euler equations using the proposed formalisms.;42 Results-Reference
30;
The double Higgs production in the models with isospin-triplet scalars is studied.;2 Problem
It is shown that in the see-saw type-II model, the mode with an intermediate heavy scalar, pp→ H+X→ 2h+X, may have the cross section that is comparable with that in the Standard Model.;42 Results-Reference
In the Georgi-Machacek model, this cross section could be much larger than in the Standard Model because the vacuum expectation value of the triplet can be large.;42 Results-Reference
31;
The equation of state is investigated for a thin superconducting film in a longitudinal magnetic film and with strong spin-orbit interaction at the critical point.;2 Problem
As a first step, the state with the maximal value of the magnetic field for a given value of spin-orbit interaction at T = 0 is chosen.;32 Method-Procedure
This state is investigated in the low-temperature region.;32 Method-Procedure
The temperature contribution to the equation of state is weakly singular.;42 Results-Reference
32;
We experimentally investigate spin-polarized electron transport between a permalloy ferromagnet and the edge of a two-dimensional electron system with band inversion, realized in a narrow, 8 nm wide, HgTe quantum well.;2 Problem, 32 Method-Procedure
In a zero magnetic field, we observe strong asymmetry of the edge potential distribution with respect to the ferromagnetic ground lead.;42 Results-Reference
This result indicates that the helical edge channel, specific for the structures with band inversion even at the conductive bulk, is strongly coupled to the ferromagnetic side contact, possibly due to the effects of proximity magnetization.;51 Conclusions-Explanation
This allows selective and spin-sensitive contacting of helical edge states.;52 Conclusions-Specific
33;
We report the results of theoretical investigations of the tunneling current noise spectra through a single-level impurity both in the presence and in the absence of electron-phonon interaction based on the nonequilibrium Green's functions formalism.;2 Problem
We show that due to the quantum nature of tunneling, the Fano factor is dramatically different from the Poisson limit both in the presence and in the absence of inelastic processes.;42 Results-Reference
The results are demonstrated to be sensitive to the tunneling contact parameters.;42 Results-Reference
34;
Based on a special variant of the plaquette expansion, an operator is constructed whose eigenvalues give the low-energy singlet spectrum of a spin-1/2 Heisenberg antiferromagnet on a square lattice with nearest-heighbor and frustrating next-nearest-neighbor exchange couplings J1 and J2.;32 Method-Procedure
It is well known that a nonmagnetic phase arises in this model for 0.4\lesssim J_2/J_1\lesssim 0.6, sandwiched by two Néel ordered phases.;1 Background
In agreement with previous results, we observe a first-order quantum phase transition (QPT) at J_2\approx 0.64J_1 from the nonmagnetic phase to the Néel one.;41 Results-Specific
A large gap (\gtrsim 0.4J_1) is found in the singlet spectrum for J2<0.64J1, which excludes a gapless spin-liquid state for 0.4\lesssim J_2/J_1\lesssim 0.6 and the deconfined quantum criticality scenario for the QPT to another Néel phase.;41 Results-Specific
We observe a first-order QPT at J_2\approx 0.55J_1, presumably between two nonmagnetic phases.;41 Results-Specific
35;
The dynamics of Dirac-Weyl spin-polarized wavepackets driven by a periodic electric field is considered for the electrons in a mesoscopic quantum dot formed at the edge of the two-dimensional HgTe/CdTe topological insulator with Dirac-Weyl massless energy spectra, where the motion of carriers is less sensitive to disorder and impurity potentials.;2 Problem
It is observed that the interplay of strongly coupled spin and charge degrees of freedom creates the regimes of irregular dynamics in both coordinate and spin channels.;42 Results-Reference
The border between the regular and irregular regimes determined by the strength and frequency of the driving field is found analytically within the quasiclassical approach by means of the Ince-Strutt diagram for the Mathieu equation, and is supported by full quantum mechanical simulations of the driven dynamics.;42 Results-Reference
The investigation of quasienergy spectrum by Floquet approach reveals the presence of non-Poissonian level statistics, which indicates the possibility of chaotic quantum dynamics and corresponds to the areas of parameters for irregular regimes within the quasiclassical approach.;42 Results-Reference
We find that the influence of weak disorder leads to partial suppression of the dynamical chaos.;42 Results-Reference
Our findings are of interest both for progress in the fundamental field of quantum chaotic dynamics and for further experimental and technological applications of spin-dependent phenomena in nanostructures based on topological insulators.;52 Conclusions-Specific
36;
We study an excitation of surface plasmons (SPs) due to the scattering of light by a dipole nanoparticle located near a flat air-metal interface.;2 Problem
It is well known that such a scattering can reveal asymmetric behavior of excited SPs with respect to the plane of incidence of light.;1 Background
This asymmetric SP excitation, which takes place at the incidence of elliptically polarized light, is often associated with the so-called photonic spin Hall effect caused by the interplay between rotating polarization of a nanoparticle and the intrinsic field angular momentum of the SP.;1 Background
We show that this photonic spin Hall effect can be applied for the SP excitation control, which allows managing the SP directivity pattern and amplitude.;52 Conclusions-Specific
The possibilities of SP control can also be extended using nanoparticles with anisotropic polarizability.;52 Conclusions-Specific
We believe that manipulations with SPs at a nanometer scale may find some applications in modern nanoplasmonics.;52 Conclusions-Specific
37;
We consider excitations that exist, in addition to phonons, in the ideal Bose gas at zero temperature.;2 Problem
These excitations are vortex rings whose energy spectrum is similar to the roton one in liquid helium.;42 Results-Reference
38;
We consider electromagnetic nonlinear normal modes in cylindrical cavity resonators filled with a nonlinear nondispersive medium.;2 Problem
The key feature of the analysis is that exact analytic solutions of the nonlinear field equations are employed to study the mode properties in detail.;32 Method-Procedure
Based on such a nonperturbative approach, we rigorously prove that the total energy of free nonlinear oscillations in a distributive conservative system, such as that considered in our work, can exactly coincide with the sum of energies of the normal modes of the system.;42 Results-Reference
This fact implies that the energy orthogonality property, which has so far been known to hold only for linear oscillations and fields, can also be observed in a nonlinear oscillatory system.;52 Conclusions-Specific
39;
The statistical theory of diffusion in concentrated BCC and FCC alloys with arbitrary pairwise interatomic interactions based on the master equation approach is developed.;42 Results-Reference
Vacancy-atom correlations are described using both the second-shell-jump and the nearest-neighbor-jump approximations which are shown to be usually sufficiently accurate.;32 Method-Procedure
General expressions for Onsager coefficients in terms of microscopic interatomic interactions and some statistical averages are given.;42 Results-Reference
Both the analytical kinetic mean-field and the Monte Carlo methods for finding these averages are described.;42 Results-Reference
The theory developed is used to describe sharp concentration dependences of diffusion coefficients in several iron-based alloy systems.;32 Method-Procedure
For the BCC alloys FeCu, FeMn, and FeNi, we predict the notable increase of the iron self-diffusion coefficient with solute concentration c, up to several times, even though values of c possible for these alloys do not exceed some percent.;42 Results-Reference
For the BCC alloys FeCr at high temperatures T\gtrsim 1400 K, we show that the very strong and peculiar concentration dependences of both tracer and chemical diffusion coefficients observed in these alloys can be naturally explained by the theory, without invoking exotic models discussed earlier.;42 Results-Reference
40;
The effect of surface states of silicon nanocrystals embedded in silicon dioxide on the photoluminescent properties of the nanocrystals is reported.;42 Results-Reference
We have investigated the time-resolved and stationary photoluminescence of silicon nanocrystals in the matrix of silicon dioxide in the visible and infrared spectral ranges at 77 and 300 K.;32 Method-Procedure
The structures containing silicon nanocrystals were prepared by the high-temperature annealing of multilayer SiOx/SiO2 films.;32 Method-Procedure
The understanding of the experimental results on photoluminescence is underlain by a model of autolocalized states arising on surface Si-Si dimers.;32 Method-Procedure
The emission of autocatalized excitons is found for the first time, and the energy level of the autolocalized states is determined.;42 Results-Reference
The effect of these states on the mechanism of the excitation and the photoluminescence properties of nanocrystals is discussed for a wide range of their dimensions.;42 Results-Reference
It is reliably shown that the cause of the known blue boundary of photoluminescence of silicon nanocrystals in the silicon dioxide matrix is the capture of free excitons on autolocalized surface states.;42 Results-Reference
41;
Viewing shungite as loosely packed fractal nets of graphene-based (reduced graphene oxide, rGO) quantum dots GQDs), we consider photoluminescence of the latter as a convincing proof of the structural concept as well as of the GQD attribution to individual rGO fragments.;2 Problem
We study emission from shungite GQDs for colloidal dispersions in water, carbon tetrachloride, and toluene at both room and low temperatures.;32 Method-Procedure
As expected, the photoluminescence of the GQD aqueous dispersions is quite similar to that of synthetic GQDs of the rGO origin.;42 Results-Reference
The morphological study of shungite dispersions shows a steady trend of GQDs to form fractals and to drastically change the colloid fractal structure caused by the solvent exchange.;42 Results-Reference
Spectral study reveals a dual character of the emitting centers: individual GQDs are responsible for the spectra position while the fractal structure of GQD colloids provides high broadening of the spectra due to structural inhomogeneity, thus causing a peculiar dependence of the photoluminescence spectra on the excitation wavelength.;42 Results-Reference
For the first time, photoluminescence spectra of individual GQDs were observed in frozen toluene dispersions, which paves the way for a theoretical treatment of the GQD photonics.;52 Conclusions-Specific
42;
New composite materials (SrFe12O19)x(CaCu3Ti4O12)1-x (x=0, 0.05, 1) have been synthesized.;41 Results-Specific
Their magnetic properties are studied in the temperature range 5-300 K using the magnetic resonance and magnetometry methods.;31 Method-Specific, 42 Results-Reference
It is found that strontium hexaferrite micro inclusions in the (SrFe12O19)0.05(CaCu3Ti4O12)0.95 composite ``magnetize'' CaCu3Ti4O12 at temperatures from 300 to 200 K, forming a ferrimagnetic particle near the SrFe12O19 ``core''.;41 Results-Specific
The magnetic resonance line below 200 K splits into two lines corresponding to SrFe12O19 and CaCu3Ti4O12.;41 Results-Specific
The core effect decoration is manifested in the increase in the Curie-Weiss temperature from 25 K in CaCu3Ti4O12 without the doping ceramics to 80 K in the composite with 5% of SrFe12O19.;41 Results-Specific
43;
We report a study of magnetic, electrical, and thermodynamic properties of a single crystal of the magnetic compound Cr0.26NbS1.74 at ambient and high pressures.;2 Problem
Results of the measurements of magnetization as a function of temperature reveal the existence of a ferromagnetic phase transition in Cr0.26NbS1.74.;42 Results-Reference
The effective number of Bohr magnetons per Cr atom in the paramagnetic phase of Cr0.26NbS1.74 is \mu _{eff}\approx 4.6\mu _B, which matches the literature data for Cr1/3NbS2.;41 Results-Specific
Similarly, the effective number of Bohr magnetons per Cr atom in the saturation fields is rather close in both substances and corresponds to the number of magnetons in the Cr+3 ion.;42 Results-Reference
In contrast to the stoichiometric compound, Cr0.26NbS1.74 does not show a metamagnetic transition, that indicates the lack of a magnetic soliton.;42 Results-Reference
A high-pressure phase diagram of the compound reveals the quantum phase transition at T=0 and P\approx 4.2 GPa and the triple point situated at T\approx 20 K and P\approx 4.2 GPa.;41 Results-Specific
44;
Gapless phases in ground states of low-dimensional quantum spin systems are rather ubiquitous.;1 Background
Their peculiarity is a remarkable sensitivity to external perturbations due to permanent criticality of such phases manifested by a slow (power-low) decay of pair correlations and the divergence of the corresponding susceptibility.;1 Background
A strong influence of various defects on the properties of the system in such a phase can then be expected.;2 Problem
Here, we consider the influence of vacancies on the thermodynamics of the simplest quantum model with a gapless phase, the isotropic spin-1/2 XX chain.;2 Problem
The existence of the exact solution of this model gives a unique opportunity to describe in detail the dramatic effect of dilution on the gapless phase - the appearance of an infinite series of quantum phase transitions resulting from level crossing under the variation of a longitudinal magnetic field.;2 Problem
We calculate the jumps in the field dependences of the ground-state longitudinal magnetization, susceptibility, entropy, and specific heat appearing at these transitions and show that they result in a highly nonlinear temperature dependence of these parameters at low T.;32 Method-Procedure, 41 Results-Specific
Also, the effect of enhancement of the magnetization and longitudinal correlations in the dilute chain is established.;42 Results-Reference
The changes of the pair spin correlators under dilution are also analyzed.;42 Results-Reference
The universality of the mechanism of the quantum transition generation suggests that similar effects of dilution can also be expected in gapless phases of other low-dimensional quantum spin systems.;52 Conclusions-Specific
45;
We study the normal (nonsuperconducting) phase of the attractive Hubbard model within the dynamical mean field theory (DMFT) using the numerical renormalization group (NRG) as an impurity solver.;2 Problem, 31 Method-Specific
A wide range of attractive potentials U is considered, from the weak-coupling limit, where superconducting instability is well described by the BCS approximation, to the strong-coupling region, where the superconducting transition is described by Bose condensation of compact Cooper pairs, which are formed at temperatures much exceeding the superconducting transition temperature.;32 Method-Procedure
We calculate the density of states, the spectral density, and the optical conductivity in the normal phase for this wide range of U, including the disorder effects.;42 Results-Reference
We also present the results on superconducting instability of the normal state dependence on the attraction strength U and the degree of disorder.;42 Results-Reference
The disorder influence on the critical temperature Tc is rather weak, suggesting in fact the validity of Anderson's theorem, with the account of the general widening of the conduction band due to disorder.;52 Conclusions-Specific
46;
The earlier-suggested master equation approach is used to develop the statistical theory of steady-state diffusion in concentrated substitution alloys considering FCC alloys with the nearest-neighbor pairwise interactions as an example.;2 Problem, 31 Method-Specific
General expressions for the Onsager coefficients in terms of microscopic interatomic interactions and some statistical averages are presented.;42 Results-Reference
We discuss methods of calculations of these averages using various statistical approximations and various approximations for description of vacancy correlations, with the full taking into account the vacancy-solute interactions.;42 Results-Reference
Our simplest statistical approximation, called the ``kinetic mean-field approximation'' (KMFA), corresponds to using the mean-field approximation for statistical averages and the pair-cluster approximation (PCA) for calculations of thermodynamic parameters, for dilute alloys, the KMFA is exact.;31 Method-Specific
To describe vacancy correlation effects at any concentrations, we develop both the nearest-neighbor-jump approximation and the second-shell-jump approximation.;31 Method-Specific
We also describe methods to take into account fluctuations in statistical averages using the PCA, and to describe non-pairwise vacancy-solute correlations using the triple vacancy-solute correlation model.;31 Method-Specific
For each of approximations and methods developed, we derive expressions for the Onsager coefficients at any composition of an alloy.;42 Results-Reference
For binary alloys, we also present expressions for the diffusion coefficients.;42 Results-Reference
The results obtained can provide a basis for microscopic calculations of diffusion coefficients at any composition of an alloy.;52 Conclusions-Specific
47;
Highly anisotropic ``nematically ordered'' aerogel induces global uniaxial anisotropy in superfluid 3 He.;2 Problem
The anisotropy lowers symmetry of 3 He in the aerogel from spherical to axial.;2 Problem
As a result, instead of one transition temperature in a state with an orbital moment l=1 there are two, corresponding to projections lz=0 and l_z=\pm1.;41 Results-Specific
This splitting has a pronounced effect on the phase diagram of superfluid 3 He and on the structures of the appearing phases.;42 Results-Reference
Possible phase diagrams, obtained phenomenologically on the basis of Landau expansion of the thermodynamic potential in the vicinity of the transition temperature are presented here.;32 Method-Procedure, 42 Results-Reference
The order parameters corresponding to each phase and their temperature dependences are found.;42 Results-Reference
48;
We report the results on the measurements of the work function of single-walled carbon nanotubes encapsulated by AgI (AgI@SWCNT), AgCl (AgCl@SWCNT), and CuBr (CuBr@SWCNT) by the local Kelvin probe technique.;31 Method-Specific, 42 Results-Reference
We found the values of the work function of tubes encapsulated with AgI and AgCl (Φ (AgI@SWCNT)=5.08\pm 0.02, Φ (AgCl@SWCNT)= 5.10 \pm 0.02 eV) to exceed substantially that of pristine carbon nanotubes, and the value of the work function of carbon nanotubes encapsulated with CuBr is Φ (CuBr@SWCNT)= 4.89 \pm 0.03 (eV).;41 Results-Specific
The measurements are carried out using different kinds of microscope probes including multi-walled carbon nanotube tips.;32 Method-Procedure
49;
