1;
При этом единым образом описывается также и внутренняя область черной дыры,  поскольку в координатах Пенлеве - Гуллстранда отсутствует сингулярность на горизонте событий.;51 Conclusions-Explanation
Представлено точное решение, описывающее стационарную аккрецию предельно жесткой материи (\varepsilon\propto n^2) на движущуюся черную дыру вплоть до центральной сингулярности.;42 Results-Reference
В приближении локальной индукции выведено уравнение движения тонкой вихревой нити на фоне такого аккреционного потока.;42 Results-Reference
В явном виде вычислен гамильтониан для жидкости с ультрарелятивистским уравнением состояния \varepsilon\propto n^{4/3} и решена задача о центрально-симметричном стационарном течении такой материи.;42 Results-Reference
67;
Рассматривается задача о парообразовании в системе двух несмешивающихся жидкостей при температурах, меньших температуры объемного кипения каждой из компонент, но больших температуры, при которой сумма давлений насыщенных паров компонент равна атмосферному давлению.;2 Problem
В этой ситуации происходит кипение на поверхности прямого контакта двух компонент.;32 Method-Procedure
Построено теоретическое описание кинетики парового слоя на границе контакта и получено решение для идеализированного случая, когда свойства двух жидкостей близки.;42 Results-Reference
Рассмотрены связь решения для  кинетики парового слоя с интегральными характеристиками режима кипения системы и вопрос об остывании системы в отсутствие притока тепла.;42 Results-Reference
68;
Методом диаграммной техники Келдыша для фермиевских и хаббардовских операторов рассмотрен квантовый транспорт электронов через магнитную примесь, находящуюся во внешнем магнитном поле и подверженную влиянию подложки.;31 Method-Specific, 42 Results-Reference
Показано, что в условиях сильной неравновесности, индуцированной процессами многократного отражения электронов на примеси, вольт-амперная характеристика устройства содержит участки с отрицательной проводимостью.;42 Results-Reference
Этим эффектом можно управлять посредством изменения  параметра анизотропии примесного центра, а также параметров связи магнитной примеси с металлическими контактами.;51 Conclusions-Explanation
Включение магнитного поля сопровождается увеличением числа кулоновских ступенек в вольт-амперной характеристике примеси.;41 Results-Specific
При этом возникает эффект значительного магнитосопротивления.;41 Results-Specific
В режиме асимметричной связи магнитной примеси с контактами показана возможность переключения между ее состояниями с различными значениями проекции полного спина.;42 Results-Reference
69;
Приведены результаты измерения квазиизэнтропической сжимаемости плазмы дейтерия и гелия в области давлений 1500-5000 ГПа и плотностей до 8 г/см3 с использованием экспериментальных устройств сферической геометрии и рентгенографического комплекса, состоящего из трех бетатронов и многоканальной оптико-электронной системы регистрации рентгеновских изображений.;42 Results-Reference
Результаты наших исследований показывают возможности экспериментальной физики высоких плотностей энергии в воспроизведении экстремальных состояний вещества, типичных для Вселенной, в лабораторных условиях с использованием энергии традиционных конденсированных взрывчатых веществ.;52 Conclusions-Specific
70;
Предложена комбинированная атака на протокол квантового распределения ключей с дифференциально-фазовым кодированием.;42 Results-Reference
Получены оценки для длины линии связи, до которой гарантируется секретное распределение ключей.;42 Results-Reference
71;
Проведен анализ влияния магнитного поля на свойства массивного нейтрино.;42 Results-Reference
Получено общее выражение для собственно-энергетического оператора нейтрино во внешнем магнитном поле произвольной напряженности.;42 Results-Reference
Данное выражение справедливо при произвольном соотношении между массами нейтрино, заряженного лептона и W-бозона.;51 Conclusions-Explanation
Исследован аномальный магнитный момент стандартного нейтрино.;42 Results-Reference
Вычислена вероятность распада массивного нейтрино на W-бозон и заряженный лептон при различных значениях напряженности магнитного поля.;42 Results-Reference
72;
Исследуется зависимость свойств конечных двухкомпонентных ферми-систем, содержащих два типа противоположно заряженных частиц, от соотношения их масс.;2 Problem
Предложена теоретическая модель на основе квантовомеханического описания системы, содержащей конечное число пар частиц, основанная на приближениях Хартри - Фока и случайных фаз с обменом.;42 Results-Reference
В рамках приближения случайных фаз с обменом также разработан метод, позволяющий исключить из спектра возбужденных состояний движение центра масс системы.;42 Results-Reference
На основе данной модели были вычислены энергии связи и статические дипольные поляризуемости систем, содержащих 8, 20 и 40 пар противоположно заряженных частиц при различных соотношениях их масс.;42 Results-Reference
73;
Исследована намагниченность образцов Ba0.6 K0.4 BiO3 в полях до 90 кЭ в температурном диапазоне от 2 К до 30 К.;42 Results-Reference
Показано, что наблюдаемое увеличение ширины петли намагниченности можно объяснить уменьшением фазовой неоднородности при усилении магнитного поля.;42 Results-Reference
Асимметричные гистерезисные зависимости намагниченности с вторичным пиком были успешно описаны расширенной моделью критического состояния, учитывающей фазовое расслоение в сверхпроводнике.;42 Results-Reference
74;
Исследована электронная структура тория в низко- и высокотемпературной кубических фазах при нормальных условиях и под давлением при помощи зонного метода LDA+U+SO.;42 Results-Reference
Поскольку для корректного описания физических свойств тория и других актиноидных металлов важен учет не только спин-орбитального, но и кулоновского взаимодействия, величины параметров этих взаимодействий были дополнительно вычислены.;51 Conclusions-Explanation
Под давлением происходит уширение электронных 5f-состояний металлического тория со значительным увеличением их заселенности.;41 Results-Specific
75;
Проанализированы волновые режимы конечно-амплитудной электроконвекции в слабопроводящей жидкости, находящейся в модулированном поле горизонтального конденсатора и нагреваемой сверху.;42 Results-Reference
Слабую проводимость жидкости обеспечивают инжектированные с анода заряды и собственные (диссоциировавшие) ионы.;51 Conclusions-Explanation
Построена бифуркационная диаграмма решений.;42 Results-Reference
Кроме режимов модулированных стоячих и бегущих волн, найдены устойчивые волны, меняющие свое направление движения, и волны, фазовая скорость которых меняется хаотически.;42 Results-Reference
76;
Теоретически исследованы спектральные особенности скорости светоиндуцированного дрейфа (СИД) атомов рубидия ({\rm ^{85}Rb} и {\rm ^{87}Rb}) в буферной среде аргона и в бинарных буферных смесях инертных газов {\rm Ne + Ar}, {\rm Ne + Kr}, {\rm Ne + Xe}, {\rm He + Ar}, {\rm He + Kr}, {\rm He + Xe}.;42 Results-Reference
Предсказывается сильная зависимость спектральной формы сигнала СИД атомов Rb в атмосфере Ar от температуры в интервале температур 450 \rm К < T < 800 K.;42 Results-Reference
Показано, что аномальный СИД атомов Rb в бинарных буферных смесях инертных газов можно наблюдать практически при любой (в том числе и при комнатной) температуре в зависимости от долей неона или гелия в этих смесях.;42 Results-Reference
Полученные результаты дают возможность высокоточного тестирования в экспериментах по СИД межатомных потенциалов взаимодействия, использованных для расчетов скорости дрейфа для аномального СИД.;52 Conclusions-Specific
77;
Рассмотрена (2+1)-мерная калибровочная модель Скирма со слагаемым Черна - Саймонса.;42 Results-Reference
Наличие слагаемого Черна - Саймонса приводит к возможности существования в данной модели двумерных скирмионов, несущих магнитный поток, обладающих электрическим зарядом и ненулевым угловым моментом.;51 Conclusions-Explanation
Показано, что модель также допускает существование двумерных скирмионов с ненулевой фазовой частотой вращения.;42 Results-Reference
Нетривиальные топологические свойства модели приводят к тому, что магнитный поток, электрический заряд и угловой момент вращающегося двумерного скирмиона оказываются связанными друг с другом.;51 Conclusions-Explanation
Выполнены аналитические и численные исследования свойств вращающихся двумерных скирмионов.;42 Results-Reference
78;
Исследовано влияние фокусировки фононов на анизотропию и температурные зависимости теплопроводности кремниевых нанопроводов в рамках трехмодовой модели Каллавея.;42 Results-Reference
Показано, что рассчитанные температурные зависимости теплопроводности кремниевых нанопроводов диаметрами более 50 нм в интервале от 20 до 300 К хорошо согласуются с экспериментальными данными.;42 Results-Reference
Определены температуры перехода от граничного рассеяния к объемным механизмам релаксации.;42 Results-Reference
Проанализировано изменение анизотропии теплопроводности нанопроводов с температурой.;42 Results-Reference
Показано, что длины свободного пробега фононов различных поляризаций для кремниевых нанопроводов в режиме граничного рассеяния существенно различаются и в значительной степени определяются эффектом фокусировки фононов.;42 Results-Reference
В направлениях фокусировки они достигают максимальных значений и превосходят длины пробега остальных колебательных мод.;41 Results-Specific
Однако для модели изотропной среды длины пробега фононов  для различных поляризаций совпадают и полностью определяются геометрическими параметрами нанопроводов.;53 Conclusions-Reference
79;
Электронные энергетические спектры апериодических цепочек Тью - Морзе, Рудина - Шапиро и двупериодической цепочки квантовых точек исследованы в приближении сильной связи.;42 Results-Reference
Изучена зависимость спектра от всех параметров «смешанной» модели апериодической цепочки: электронной энергии в квантовых точках и интегралов перекрытия.;42 Results-Reference
Электронная степень локализации в рассматриваемых цепочках получена с помощью анализа обратной степени участия.;32 Method-Procedure, 42 Results-Reference
Рассчитано ее спектральное распределение и зависимость средней по зоне степени локализации от указанных параметров модели.;42 Results-Reference
Показано, что при варьировании параметров возможен переход узлов системы в резонансное состояние, в котором степень локализации электронов уменьшается, а в спектре при этом происходит перекрытие подзон.;42 Results-Reference
80;
Исследуется распространение необыкновенного луча в ячейке с киральным жидким кристаллом при наклонном падении.;2 Problem
Для ячейки с 180-градусной закруткой изучается зависимость от приложенного напряжения минимального угла падения, при котором свет еще не проходит через ячейку.;42 Results-Reference
Путем прямой минимизации свободной энергии рассчитана ориентационная структура жидкого кристалла во внешнем электрическом поле.;32 Method-Procedure, 42 Results-Reference
Это позволило определить траектории лучей и предельные углы рефракции.;51 Conclusions-Explanation
Результаты расчетов согласуются с экспериментом.;42 Results-Reference
Показано, что для совпадения теории с экспериментом существен учет неоднородности электрического поля в киральной системе.;42 Results-Reference
81;
На основе квантовомеханического выражения для ядра интеграла столкновений и дисперсионного потенциала межмолекулярных взаимодействий рассчитаны контуры линий, в которых одновременно учтены столкновения с рассеянием на большие и классические малые углы, а также дифракционное рассеяние молекул.;42 Results-Reference
В результате сопоставления расчетных контуров с контурами в моделях сильных по скоростям столкновений показано, что непринятие в рассмотрение слабых столкновений приводит к заметно более острой форме линий.;52 Conclusions-Specific
В целях количественной обработки спектров проведена параметризация расчетных контуров и получена их алгебраическая аппроксимация.;42 Results-Reference
82;
Исследована возможность моделирования процессов при взрыве сверхновых звезд в лабораторных условиях с помощью мощных лазеров (лабораторная астрофизика).;42 Results-Reference
Проведен анализ результатов наблюдения остатков сверхновой Кассиопея A обсерваторией Чандра.;42 Results-Reference
На основе численных кодов DIANA и NUTCY проведены одномерные и двумерные гидродинамические расчеты, моделирующие динамику процессов разлета остатков сверхновой звезды с массой порядка 5-15 масс Солнца в течение нескольких сотен секунд после момента взрыва, в том числе с учетом начальной несимметрии.;42 Results-Reference
Предложена модель взрыва и разлета остатков, которая иллюстрирует сильные неоднородности распределения вещества вплоть до того, что вещество Fe, Si, S из центра звезды оказывается выброшенным на периферию - «звезда выворачивается наизнанку», что соответствует наблюдениям.;42 Results-Reference
На основании критериев гидродинамического подобия рассмотрены возможные лазерные мишени-имитаторы сверхновых, которые позволят воспроизвести физические процессы, имеющие место при взрыве астрофизического объекта, такие как распространение ударной волны по веществу, развитие гидродинамических неустойчивостей на границах разноплотных оболочек и др.;42 Results-Reference
83;
Рассматривается одномерный фотонный кристалл и падающая на него световая волна, направление которой неколлинеарно градиенту диэлектрической проницаемости кристалла.;2 Problem
